{
  "schema": "fmea-mining.evidence-requirements.v1",
  "version": "1.3.8",
  "status": "requirements_planned_not_observed",
  "methodFieldGlossary": {
    "equipmentContext": {
      "id": "equipmentContext",
      "type": "required_when_executed",
      "descriptionPt": "equipment context",
      "requiredForInterpretation": true
    },
    "inspectionLocation": {
      "id": "inspectionLocation",
      "type": "required_when_executed",
      "descriptionPt": "inspection location",
      "requiredForInterpretation": true
    },
    "isolationStatus": {
      "id": "isolationStatus",
      "type": "required_when_executed",
      "descriptionPt": "isolation status",
      "requiredForInterpretation": true
    },
    "surfaceCondition": {
      "id": "surfaceCondition",
      "type": "required_when_executed",
      "descriptionPt": "surface condition",
      "requiredForInterpretation": true
    },
    "visualDocumentation": {
      "id": "visualDocumentation",
      "type": "required_when_executed",
      "descriptionPt": "visual documentation",
      "requiredForInterpretation": true
    },
    "dateTime": {
      "id": "dateTime",
      "type": "required_when_executed",
      "descriptionPt": "date time",
      "requiredForInterpretation": true
    },
    "measurementLocation": {
      "id": "measurementLocation",
      "type": "required_when_executed",
      "descriptionPt": "measurement location",
      "requiredForInterpretation": true
    },
    "instrumentId": {
      "id": "instrumentId",
      "type": "required_when_executed",
      "descriptionPt": "instrument id",
      "requiredForInterpretation": true
    },
    "instrumentCalibrationStatus": {
      "id": "instrumentCalibrationStatus",
      "type": "required_when_executed",
      "descriptionPt": "instrument calibration status",
      "requiredForInterpretation": true
    },
    "measuredGeometry": {
      "id": "measuredGeometry",
      "type": "required_when_executed",
      "descriptionPt": "measured geometry",
      "requiredForInterpretation": true
    },
    "unit": {
      "id": "unit",
      "type": "required_when_executed",
      "descriptionPt": "unit",
      "requiredForInterpretation": true
    },
    "applicableToleranceReference": {
      "id": "applicableToleranceReference",
      "type": "required_when_executed",
      "descriptionPt": "applicable tolerance reference",
      "requiredForInterpretation": true
    },
    "surfaceEmissivityOrLimitation": {
      "id": "surfaceEmissivityOrLimitation",
      "type": "required_when_executed",
      "descriptionPt": "surface emissivity or limitation",
      "requiredForInterpretation": true
    },
    "ambientTemperature": {
      "id": "ambientTemperature",
      "type": "required_when_executed",
      "descriptionPt": "ambient temperature",
      "requiredForInterpretation": true
    },
    "loadOrOperatingState": {
      "id": "loadOrOperatingState",
      "type": "required_when_executed",
      "descriptionPt": "load or operating state",
      "requiredForInterpretation": true
    },
    "comparisonBasis": {
      "id": "comparisonBasis",
      "type": "required_when_executed",
      "descriptionPt": "comparison basis",
      "requiredForInterpretation": true
    },
    "sensorLocation": {
      "id": "sensorLocation",
      "type": "required_when_executed",
      "descriptionPt": "sensor location",
      "requiredForInterpretation": true
    },
    "rotationalSpeed": {
      "id": "rotationalSpeed",
      "type": "required_when_executed",
      "descriptionPt": "rotational speed",
      "requiredForInterpretation": true
    },
    "operatingLoad": {
      "id": "operatingLoad",
      "type": "required_when_executed",
      "descriptionPt": "operating load",
      "requiredForInterpretation": true
    },
    "frequencyContentOrSignal": {
      "id": "frequencyContentOrSignal",
      "type": "required_when_executed",
      "descriptionPt": "frequency content or signal",
      "requiredForInterpretation": true
    },
    "baselineReference": {
      "id": "baselineReference",
      "type": "required_when_executed",
      "descriptionPt": "baseline reference",
      "requiredForInterpretation": true
    },
    "circuitOrTestPoint": {
      "id": "circuitOrTestPoint",
      "type": "required_when_executed",
      "descriptionPt": "circuit or test point",
      "requiredForInterpretation": true
    },
    "fluidTemperature": {
      "id": "fluidTemperature",
      "type": "required_when_executed",
      "descriptionPt": "fluid temperature",
      "requiredForInterpretation": true
    },
    "oemTestReference": {
      "id": "oemTestReference",
      "type": "required_when_executed",
      "descriptionPt": "oem test reference",
      "requiredForInterpretation": true
    },
    "circuitOrPin": {
      "id": "circuitOrPin",
      "type": "required_when_executed",
      "descriptionPt": "circuit or pin",
      "requiredForInterpretation": true
    },
    "electricalState": {
      "id": "electricalState",
      "type": "required_when_executed",
      "descriptionPt": "electrical state",
      "requiredForInterpretation": true
    },
    "controllerIdentity": {
      "id": "controllerIdentity",
      "type": "required_when_executed",
      "descriptionPt": "controller identity",
      "requiredForInterpretation": true
    },
    "activeOrLogged": {
      "id": "activeOrLogged",
      "type": "required_when_executed",
      "descriptionPt": "active or logged",
      "requiredForInterpretation": true
    },
    "eventTimestamp": {
      "id": "eventTimestamp",
      "type": "required_when_executed",
      "descriptionPt": "event timestamp",
      "requiredForInterpretation": true
    },
    "operatingState": {
      "id": "operatingState",
      "type": "required_when_executed",
      "descriptionPt": "operating state",
      "requiredForInterpretation": true
    },
    "codeFamily": {
      "id": "codeFamily",
      "type": "required_when_executed",
      "descriptionPt": "code family",
      "requiredForInterpretation": true
    },
    "compartment": {
      "id": "compartment",
      "type": "required_when_executed",
      "descriptionPt": "compartment",
      "requiredForInterpretation": true
    },
    "fluidProduct": {
      "id": "fluidProduct",
      "type": "required_when_executed",
      "descriptionPt": "fluid product",
      "requiredForInterpretation": true
    },
    "fluidHours": {
      "id": "fluidHours",
      "type": "required_when_executed",
      "descriptionPt": "fluid hours",
      "requiredForInterpretation": true
    },
    "samplePoint": {
      "id": "samplePoint",
      "type": "required_when_executed",
      "descriptionPt": "sample point",
      "requiredForInterpretation": true
    },
    "collectionMethod": {
      "id": "collectionMethod",
      "type": "required_when_executed",
      "descriptionPt": "collection method",
      "requiredForInterpretation": true
    },
    "laboratoryMethod": {
      "id": "laboratoryMethod",
      "type": "required_when_executed",
      "descriptionPt": "laboratory method",
      "requiredForInterpretation": true
    },
    "cleanSamplingControls": {
      "id": "cleanSamplingControls",
      "type": "required_when_executed",
      "descriptionPt": "clean sampling controls",
      "requiredForInterpretation": true
    },
    "particleMeasurementMethod": {
      "id": "particleMeasurementMethod",
      "type": "required_when_executed",
      "descriptionPt": "particle measurement method",
      "requiredForInterpretation": true
    },
    "testMethod": {
      "id": "testMethod",
      "type": "required_when_executed",
      "descriptionPt": "test method",
      "requiredForInterpretation": true
    },
    "interferenceOrQualityCheck": {
      "id": "interferenceOrQualityCheck",
      "type": "required_when_executed",
      "descriptionPt": "interference or quality check",
      "requiredForInterpretation": true
    },
    "componentOrFilterId": {
      "id": "componentOrFilterId",
      "type": "required_when_executed",
      "descriptionPt": "component or filter id",
      "requiredForInterpretation": true
    },
    "removalAndHandlingMethod": {
      "id": "removalAndHandlingMethod",
      "type": "required_when_executed",
      "descriptionPt": "removal and handling method",
      "requiredForInterpretation": true
    },
    "residueMorphology": {
      "id": "residueMorphology",
      "type": "required_when_executed",
      "descriptionPt": "residue morphology",
      "requiredForInterpretation": true
    },
    "photographOrRecord": {
      "id": "photographOrRecord",
      "type": "required_when_executed",
      "descriptionPt": "photograph or record",
      "requiredForInterpretation": true
    },
    "baselineOrHistory": {
      "id": "baselineOrHistory",
      "type": "required_when_executed",
      "descriptionPt": "baseline or history",
      "requiredForInterpretation": true
    },
    "testConfiguration": {
      "id": "testConfiguration",
      "type": "required_when_executed",
      "descriptionPt": "test configuration",
      "requiredForInterpretation": true
    },
    "safetyAndIsolationStatus": {
      "id": "safetyAndIsolationStatus",
      "type": "required_when_executed",
      "descriptionPt": "safety and isolation status",
      "requiredForInterpretation": true
    },
    "fluidTemperatureIfApplicable": {
      "id": "fluidTemperatureIfApplicable",
      "type": "required_when_executed",
      "descriptionPt": "fluid temperature if applicable",
      "requiredForInterpretation": true
    },
    "measurementInstrument": {
      "id": "measurementInstrument",
      "type": "required_when_executed",
      "descriptionPt": "measurement instrument",
      "requiredForInterpretation": true
    },
    "oemProcedureReference": {
      "id": "oemProcedureReference",
      "type": "required_when_executed",
      "descriptionPt": "oem procedure reference",
      "requiredForInterpretation": true
    },